{
  "errorCode": "errorCode",
  "callBackInfo": null,
  "success": false,
  "errorKind": "errorKind",
  "message": "message",
  "errorMessage": "errorMessage",
  "vendorCosts": [
    {
      "itemId": "itemId",
      "costs": [
        {
          "cost": 0.0,
          "quantity": 0.0,
          "skipStoringCost": false,
          "customFields": {},
          "message": "message"
        }
      ],
      "stockLevel": 0,
      "availability": [
        {
          "itemCount": 0.0,
          "disposition": null,
          "status": "status",
          "message": "message",
          "startingDate": "2026-03-04T14:39:07.2885278+00:00"
        }
      ]
    }
  ],
  "$schema": "./pricing.response.schema.json"
}